{
  "$schema": "https://raw.githubusercontent.com/isAlmogK/trustbut/main/spec/agent-receipt-v1.schema.json",
  "specVersion": "1.0",
  "producer": { "name": "trustbut", "version": "0.4.0" },
  "subject": { "base": "3f2a91c0d4b6e8a1f2c3d4e5f6a7b8c9d0e1f2a3", "head": "8be04d1a2b3c4d5e6f7a8b9c0d1e2f3a4b5c6d7e" },
  "verdict": "pass",
  "tests": { "passed": 42, "failed": 0, "errored": 0, "skipped": 0, "scope": "full" },
  "proofs": [
    { "file": "test/sum.test.ts", "name": "adds negative numbers", "before": "fail", "after": "pass", "verdict": "proves-change" }
  ],
  "findings": [],
  "risks": []
}
